{"policyVersion":"hiveforge.intent-reality.v1","work":{"id":"redwood-rs-engine-001","title":"Revenue Sustainability Analysis Spine","scope":"critical","authority":["Direct user overnight build instruction."]},"intent":{"productGoal":"Build reusable run-bound Revenue Sustainability analysis without autonomous professional normalization.","capability":"Shared comparison/coverage/decomposition evidence layer across provider, payer, service line, location, and patient responsibility.","architecturalIntent":["Evidence and professional judgment remain separate.","Comparison scope is immutable and explicit.","Residuals and unsupported evidence remain visible."],"invariants":["No autonomous normalization.","No forced reconciliation.","No patient responsibility inferred from patient cash."],"acceptanceEvidence":["Core tests, typechecks, build, RS-PAYER-SHIFT-001 attempted run, and documented patient-source limitation."]},"execution":{"observedBehaviour":["Run-bound sustainability analysis, Analyze surface, and workbook evidence sheets were implemented.","Payer proof exposed a scope reconciliation defect without forcing a balance.","Patient responsibility was withheld pending a dedicated source contract."],"evidence":[{"kind":"test","reference":"pnpm --filter @redwood/core test","result":"23/23 passed before payer proof execution."},{"kind":"trace","reference":"Run 42a2779d-ae96-44d0-be78-b38f542c04dc","result":"Payer comparison executed; G3 remained blocked by visible bank-scope difference."},{"kind":"artifact","reference":"docs/REDWOOD_RS_ENGINE_001_REPORT.md","result":"Records implemented architecture and remaining boundaries."}]},"conformance":{"status":"conforms-with-understood-divergence","divergences":[{"expected":"Payer current-period controls reconcile under the declared comparison window.","observed":"Bank reconciliation includes prior-period deposits because its filter is valuation-bounded rather than analysis-period-bounded.","classification":"defect","status":"open"},{"expected":"Patient responsibility can be calculated from source evidence.","observed":"Current sources provide patient collections but no dedicated responsibility obligation/balance contract.","classification":"missing-test","status":"open"}]},"learning":{"recurringPattern":"Shared period scope must be applied identically to every comparative control population.","improvementProposal":"Add a dedicated patient responsibility source model after explicit authority.","durableKnowledge":["Patient cash is not patient responsibility.","Payer decomposition must retain residuals and evidence-only state."]},"completion":{"capabilitySatisfied":false,"invariantsPreserved":true,"evidenceSufficient":false,"reviewRequired":true}}