{"policyVersion":"hiveforge.intent-reality.v1","work":{"id":"redwood-data-estate-integration-001","title":"Data Estate Integration","scope":"substantial","authority":["Direct user data-estate integration milestone."]},"intent":{"productGoal":"Govern source acquisition, custody, rights, and adapter availability without coupling them to analytical conclusions.","capability":"Versioned source registry, custody/rights/reacquisition separation, corpus crosswalk, and adapter boundary.","architecturalIntent":["Acquisition remains outside analytical ingestion.","Physical custody and reacquirability remain distinct.","Scenario semantics are not inferred from corpus letters."],"invariants":["Public reference data never becomes a commercial-rate proxy.","No corpus bytes or source evidence are modified.","Acquisition does not bypass mapping, gates, or lineage."],"acceptanceEvidence":["Direct evidence-estate lane verification, historical main intent review, registry validation test, ADR-010."]},"execution":{"observedBehaviour":["Registry records explicit source/rights/custody/adapter states.","Challenge and engineering corpus lanes remain separate.","Scale custody documentation conflict is retained as documentation stale rather than silently overwritten."],"evidence":[{"kind":"test","reference":"packages/core/src/data-estate.test.ts; pnpm --filter @redwood/core test","result":"31/31 core tests passed including registry validation."},{"kind":"artifact","reference":"docs/evidence/redwood-source-registry.v1.json","result":"Machine-readable current source registry."},{"kind":"review","reference":"Historical main workflows and direct evidence-estate lane verification","result":"Workflow intent recovered without importing obsolete workflow structure."}]},"conformance":{"status":"conforms-with-understood-divergence","divergences":[{"expected":"Historic source-registry scale status describes current physical custody.","observed":"Older registry wording is on-demand while later custody control and direct evidence verification establish physical 1M/10M holdings.","classification":"stale-intent","status":"understood"}]},"learning":{"recurringPattern":"Workflow existence is not custody evidence.","improvementProposal":"Add append-only custody-event and artifact-manifest records from the Drive-controlled registry in a future evidence-estate receipt pass.","durableKnowledge":["Public sources may be reference context without adapter authority.","Drive remains evidence/custody authority; Git stores contracts, receipts, manifests, tests, and small fixtures."]},"completion":{"capabilitySatisfied":true,"invariantsPreserved":true,"evidenceSufficient":true,"reviewRequired":false}}